index,airport_id,name,city,country,IATA,ICAO,latitude,longitude,altitude,DST,Tz_database_time_zone	,type,source,google_airport_name,google_place_id,google_airport_full_address,airport_rating,number_ratings,website,total_routes
809,2670,Francisco De Orellana Airport,Coca,Ecuador,OCC,SECO,-0.4628860056400299,-76.98680114746094,834,U,America/Guayaquil,airport,OurAirports,Francisco de Orellana Airport,ChIJTcu6KkCl15ERE3Nqw7w2poI,"Francisco de Orellana Airport, Francisco de Orellana, Ecuador",4.2,72,not found,3
810,2671,Mariscal Lamar Airport,Cuenca,Ecuador,CUE,SECU,-2.88947,-78.984398,8306,U,America/Guayaquil,airport,OurAirports,Mariscal Lamar International Airport,ChIJac3qaS8YzZERp18A6aVcT90,"Mariscal Lamar International Airport, La Castellana, Cuenca, Ecuador",3.9,101,http://www.aeropuertocuenca.ec/,3
811,2672,Seymour Airport,Galapagos,Ecuador,GPS,SEGS,-0.4537580013275146,-90.26589965820312,207,U,Pacific/Galapagos,airport,OurAirports,Seymour Airport,ChIJlYjADXmNqpoRuqgyD5ZQtc0,"Seymour Airport, Baltra Airport Rd, Baltra, Ecuador",4.2,155,http://www.ecogal.aero,2
812,2673,José Joaquín de Olmedo International Airport,Guayaquil,Ecuador,GYE,SEGU,-2.15741991997,-79.88359832760001,19,U,America/Guayaquil,airport,OurAirports,Aeropuerto Internacional José Joaquín De Olmedo,ChIJ7xJtJr9tLZARE0ZZaR5tdyo,"Aeropuerto Internacional José Joaquín De Olmedo, José Joaquín de Olmedo, Av de Las Américas, Guayaquil 090513, Ecuador",4.4,1096,http://www.tagsa.aero/,35
813,2678,Cotopaxi International Airport,Latacunga,Ecuador,LTX,SELT,-0.906833,-78.615799,9205,U,America/Guayaquil,airport,OurAirports,Cotopaxi International Airport,ChIJc4AQJ15g1JERGymHswxBKTE,"Cotopaxi International Airport, Latacunga, Ecuador",4.2,51,not found,2
814,2683,Eloy Alfaro International Airport,Manta,Ecuador,MEC,SEMT,-0.9460780024528505,-80.67880249023438,48,U,America/Guayaquil,airport,OurAirports,Eloy Alfaro International Airport,ChIJ7cYzBvbmK5ARKdf3h_PiYBI,"Eloy Alfaro International Airport (MEC), Manta, Ecuador",3.9,76,not found,1
815,2688,Mariscal Sucre International Airport,Quito,Ecuador,UIO,SEQM,-0.129166666667,-78.3575,7841,U,America/Guayaquil,airport,OurAirports,Aeropuerto Internacional Mariscal Sucre,ChIJh6orNbSN1ZERi0uJ4CN2ny8,"Aeropuerto Internacional Mariscal Sucre, Nuevo Aeropuerto Internacional de Quito Tababela S/N - Via, Quito 170907, Ecuador",4.2,1065,http://aeropuertoquito.aero/,39
816,2699,Silvio Pettirossi International Airport,Asuncion,Paraguay,ASU,SGAS,-25.239999771118164,-57.52000045776367,292,S,America/Asuncion,airport,OurAirports,Silvio Pettirossi International Airport,ChIJpYGSxqSlXZQRiAi8NFJTFLs,"Silvio Pettirossi International Airport, Autopista Silvio Pettisossi, Luque, Paraguay",3.9,709,https://www.asuncion-airport.com/,18
817,2705,El Eden Airport,Armenia,Colombia,AXM,SKAR,4.4527800000000015,-75.7664,3990,U,America/Bogota,airport,OurAirports,El Edén International Airport,ChIJoYfz-61ZOI4RJbca2ImMuys,"El Edén International Airport, Cl. 23 #22-08, Armenia, El Eden, Armenia, Quindío, Colombia",4.0,123,not found,2
818,2706,Tres De Mayo Airport,Puerto Asis,Colombia,PUU,SKAS,0.505228,-76.5008,815,U,America/Bogota,airport,OurAirports,Tres de Mayo Airport,ChIJzyVvuNd4KI4RJWw9Ky9pBds,"Tres de Mayo Airport, Puerto Asís, Putumayo, Colombia",4.2,57,not found,4
819,2708,Palonegro Airport,Bucaramanga,Colombia,BGA,SKBG,7.1265,-73.1848,3897,U,America/Bogota,airport,OurAirports,Aeropuerto Internacional Palonegro,ChIJA15els4_aI4RhjY8ADW6inE,"Aeropuerto Internacional Palonegro, Lebrija, Santander, Colombia",4.2,332,http://bga.aerooriente.com.co/,5
820,2709,El Dorado International Airport,Bogota,Colombia,BOG,SKBO,4.70159,-74.1469,8361,U,America/Bogota,airport,OurAirports,El Dorado Luis Carlos Galan Sarmiento International Airport,ChIJB4YPQ7acP44RMK8U71RZ6o4,"El Dorado Luis Carlos Galan Sarmiento Int'l Airport (BOG), Calle 26 #103-9, Fontibon, Bogotá, Colombia",4.4,5356,http://www.eldorado.aero/,152
821,2710,Ernesto Cortissoz International Airport,Barranquilla,Colombia,BAQ,SKBQ,10.8896,-74.7808,98,U,America/Bogota,airport,OurAirports,Ernesto Cortissoz International Airport,ChIJgx3-64rN9Y4Re-YqcUuWFgk,"Ernesto Cortissoz International Airport, Aeropuerto Internacional Ernesto Cortissoz, Soledad, Atlántico, Colombia",4.0,913,http://aeropuertobaq.com/,10
822,2713,Camilo Daza International Airport,Cucuta,Colombia,CUC,SKCC,7.9275699999999985,-72.5115,1096,U,America/Bogota,airport,OurAirports,Camilo Daza International Airport,ChIJFx3heE1FZo4RAVIumEUIjgk,"Camilo Daza International Airport, Cúcuta, Norte de Santander, Colombia",4.2,113,http://cuc.aerooriente.com.co/,4
823,2714,Rafael Nuñez International Airport,Cartagena,Colombia,CTG,SKCG,10.4424,-75.513,4,U,America/Bogota,airport,OurAirports,Rafael Núñez International Airport,ChIJB0vlEkMl9o4RscO08YNjp5Y,"Rafael Núñez International Airport, Crespo Calle 70, Provincia de Cartagena, Bolívar, Colombia",4.1,1128,http://www.aeropuertocartagena.com.co/,12
824,2715,Alfonso Bonilla Aragon International Airport,Cali,Colombia,CLO,SKCL,3.54322,-76.3816,3162,U,America/Bogota,airport,OurAirports,Aeropuerto Internacional Alfonso Bonilla Aragón de Palmira,ChIJEdwwmr4GOo4RdyNtFmOdFAk,"Aeropuerto Internacional Alfonso Bonilla Aragón de Palmira, Vía al Aeropuerto Nte., Palmira, Valle del Cauca, Colombia",4.3,1014,http://www.aerocali.com.co/,30
825,2716,La Florida Airport,Tumaco,Colombia,TCO,SKCO,1.8144200000000001,-78.7492,8,U,America/Bogota,airport,OurAirports,La Serena,ChIJi5Vr28_KkZYRMlHLzpj0tok,"La Florida International Airport - Aeropuerto La Florida - Coquimbo, La Serena, Chile",3.9,120,http://www.aeropuertodelaserena.cl/es/,1
826,2718,Yariguíes Airport,Barrancabermeja,Colombia,EJA,SKEJ,7.02433,-73.8068,412,U,America/Bogota,airport,OurAirports,Yariguíes Airport,ChIJU7gYIh2TQo4R_jTvaPiMcf8,"Yariguíes Airport, Barrancabermeja, Santander, Colombia",4.1,61,http://beja.aerooriente.com.co/,1
827,2719,Gustavo Artunduaga Paredes Airport,Florencia,Colombia,FLA,SKFL,1.5891899999999999,-75.5644,803,U,America/Bogota,airport,OurAirports,Gustavo Artunduaga Paredes Airport,ChIJj9E_dAKFj4ARS7dm1Bh0mws,"Gustavo Artunduaga Paredes Airport, Florencia, Caquetá, Colombia",4.0,52,not found,2
828,2724,Perales Airport,Ibague,Colombia,IBE,SKIB,4.42161,-75.1333,2999,U,America/Bogota,airport,OurAirports,Perales Airport,ChIJF34gwe7POI4RjGZz99ypNPI,"Perales Airport, Ibagué, Tolima, Colombia",3.9,114,not found,3
829,2725,San Luis Airport,Ipiales,Colombia,IPI,SKIP,0.861925,-77.6718,9765,U,America/Bogota,airport,OurAirports,San Luis Obispo County Regional Airport,ChIJ8bl2OL_27IAR0jsPetCshvQ,"San Luis Obispo County Regional Airport, 975 Airport Dr, San Luis Obispo, CA 93401, USA",3.4,126,http://www.sloairport.com/,1
830,2726,Antonio Roldan Betancourt Airport,Carepa,Colombia,APO,SKLC,7.811960000000001,-76.7164,46,U,America/Bogota,airport,OurAirports,Airport Antonio Roldan Betancur,ChIJST_udT8RUI4RQ035p-JKqMo,"Airport Antonio Roldan Betancur, Carepa, Antioquia, Colombia",4.1,68,http://www.airplan.aero/,4
831,2728,Alfredo Vásquez Cobo International Airport,Leticia,Colombia,LET,SKLT,-4.19355,-69.9432,277,U,America/Bogota,airport,OurAirports,Vasquez Cobo International Airport,ChIJpYOp1rr28pER9rDaT_jgd-s,"Vasquez Cobo International Airport, Avenida Vasquez Cobo, Leticia, Amazonas, Colombia",3.4,71,not found,6
832,2729,Enrique Olaya Herrera Airport,Medellin,Colombia,EOH,SKMD,6.220549,-75.590582,4949,U,America/Bogota,airport,OurAirports,Olaya Herrera,ChIJLWXlT8UpRI4RUE6zcomDY1M,"Olaya Herrera, Cra. 65 #13-157, Medellín, Antioquia, Colombia",4.4,586,http://aeropuertoolayaherrera.gov.co/,11
833,2731,Los Garzones Airport,Monteria,Colombia,MTR,SKMR,8.823739999999997,-75.8258,36,U,America/Bogota,airport,OurAirports,Los Garzones International Airport,ChIJ_TgvBbQuWo4RdDqtlF3_q7w,"Los Garzones International Airport, Via Aeropuerto, Montería, Córdoba, Colombia",4.3,261,http://www.aeropuertomonteria.co/,3
834,2733,La Nubia Airport,Manizales,Colombia,MZL,SKMZ,5.0296,-75.4647,6871,U,America/Bogota,airport,OurAirports,Aeropuerto La Nubia,ChIJJdTKArBlR44RmjKG28WV1Vk,"Airport La Nubia, la Nubia, Manizales, Caldas, Colombia",3.9,122,not found,1
835,2734,Benito Salas Airport,Neiva,Colombia,NVA,SKNV,2.95015,-75.294,1464,U,America/Bogota,airport,OurAirports,Benito Salas Airport,ChIJb5tDZlh0O44Rftysb7cetAg,"Benito Salas Airport, Neiva, Huila, Colombia",4.0,117,not found,2
836,2739,Matecaña International Airport,Pereira,Colombia,PEI,SKPE,4.81267,-75.7395,4416,U,America/Bogota,airport,OurAirports,Aeropuerto Internacional Matecaña,ChIJx7YkkOd9OI4RtbXd8iYhfYE,"Aeropuerto Internacional Matecaña, Pereira, Risaralda, Colombia",4.0,358,not found,6
837,2741,Guillermo León Valencia Airport,Popayan,Colombia,PPN,SKPP,2.4544,-76.6093,5687,U,America/Bogota,airport,OurAirports,Airport Guillermo Leon Valencia,ChIJ3cz1kEADMI4Rq333yLu-Dzs,"Airport Guillermo Leon Valencia, Cl. 4 Nte., Popayán, Cauca, Colombia",3.6,123,http://www.aerocivil.gov.co/aeropuertos/Pages/guillermo-leon-valencia.aspx,1
838,2742,Antonio Narino Airport,Pasto,Colombia,PSO,SKPS,1.39625,-77.2915,5951,U,America/Bogota,airport,OurAirports,Aeropuerto Antonio Narino,ChIJXdJIdePbLo4R41StCh20__s,"Aeropuerto Antonio Narino, Chachagüí, Nariño, Colombia",3.8,106,not found,3
839,2745,Jose Maria Córdova International Airport,Rio Negro,Colombia,MDE,SKRG,6.1645400000000015,-75.4231,6955,U,America/Bogota,airport,OurAirports,José María Córdova International Airport,ChIJD3JAuHieRo4RuOG4qKKpY5I,"José María Córdova International Airport, Rionegro, Antioquia, Colombia",4.3,1810,http://www.aeropuertorionegro.co/,26
840,2746,Almirante Padilla Airport,Rio Hacha,Colombia,RCH,SKRH,11.5262,-72.926,43,U,America/Bogota,airport,OurAirports,Riohacha Airport,ChIJgyGhCMFii44ROk9r0SVoUrc,"Riohacha Airport, Cl. 30 #26a-81, Riohacha, La Guajira, Colombia",4.2,115,http://rch.aerooriente.com.co/,1
841,2748,Simón Bolívar International Airport,Santa Marta,Colombia,SMR,SKSM,11.1196,-74.2306,22,U,America/Bogota,airport,OurAirports,Simón Bolívar International Airport,ChIJm1N-ymNdKowRDeodyu8Sk7I,"Simón Bolívar International Airport, Maiquetía 1162, Vargas, Venezuela",3.5,185,http://www.aeropuerto-maiquetia.com.ve/,4
842,2749,Gustavo Rojas Pinilla International Airport,San Andres Island,Colombia,ADZ,SKSP,12.5836,-81.7112,19,U,America/Bogota,airport,OurAirports,Aeropuerto Internacional Gustavo Rojas Pinilla,ChIJ6cLpdAimBY8RLQWm0QoMloM,"Aeropuerto Internacional Gustavo Rojas Pinilla, Av Colon, San Andrés, Colombia",3.3,625,"http://www.aerocivil.gov.co/aeropuertos/Pages/San-Andr%C3%A9s,-Gustavo-Rojas-Pinilla.aspx",11
843,2753,El Caraño Airport,Quibdo,Colombia,UIB,SKUI,5.69076,-76.6412,204,U,America/Bogota,airport,OurAirports,El Caraño Airport,ChIJazWbonyPSI4RFUhQ-84o0Hw,"El Caraño Airport, Quibdó, Chocó, Colombia",4.1,180,http://www.aeropuertoquibdo.co/,6
844,2755,Alfonso López Pumarejo Airport,Valledupar,Colombia,VUP,SKVP,10.435,-73.2495,483,U,America/Bogota,airport,OurAirports,Airport Alfonso Lopez,ChIJGbRnRSG6io4RFvaKO58RaDQ,"Airport Alfonso Lopez, Valledupar, Cesar, Colombia",4.2,127,http://vup.aerooriente.com.co/,2
845,2756,Vanguardia Airport,Villavicencio,Colombia,VVC,SKVV,4.16787,-73.6138,1394,U,America/Bogota,airport,OurAirports,La Vanguardia Airport,ChIJYU7-wLAtPo4RDGr7hyxwDaI,"La Vanguardia Airport, Villavicencio, Meta, Colombia",3.7,106,not found,8
846,2759,Jorge Wilsterman International Airport,Cochabamba,Bolivia,CBB,SLCB,-17.421100616455078,-66.17710113525389,8360,U,America/La_Paz,airport,OurAirports,Jorge Wilstermann Airport,ChIJa6c8UKNz45MRijXfM6DffYE,"Jorge Wilstermann Airport, Cochabamba, Bolivia",4.1,303,not found,8
847,2761,Capitán Aníbal Arab Airport,Cobija,Bolivia,CIJ,SLCO,-11.0403995514,-68.78299713130001,889,U,America/La_Paz,airport,OurAirports,Captain Anibal Arab Airport,ChIJMXWFXj6xfpERLM0DwTigZrk,"Captain Anibal Arab Airport, Carr a Porvenir Km 3, Cobija, Bolivia",3.9,51,not found,2
848,2762,El Alto International Airport,La Paz,Bolivia,LPB,SLLP,-16.513299942016598,-68.19229888916016,13355,U,America/La_Paz,airport,OurAirports,El Alto International Airport,ChIJo2QCUK3fXpERJkXc9myKetU,"El Alto International Airport, Huascar 204, El Alto, Bolivia",3.9,433,http://www.sabsa.aero/,26
849,2763,Juan Mendoza Airport,Oruro,Bolivia,ORU,SLOR,-17.962600708,-67.0762023926,12152,U,America/La_Paz,airport,OurAirports,Juan Mendoza Airport,ChIJmwIdNEO34pMRdoaX8G1uCHo,"Juan Mendoza Airport, Oruro, Bolivia",3.6,55,not found,4
850,2767,Juana Azurduy De Padilla Airport,Sucre,Bolivia,SRE,SLSU,-19.007099151611328,-65.2886962890625,9540,U,America/La_Paz,airport,OurAirports,Sucre Airport,ChIJkbQ8einG-5MRBvhtMZpoKK8,"Sucre Airport, Sucre, Bolivia",3.4,50,not found,6
851,2768,Capitan Oriel Lea Plaza Airport,Tarija,Bolivia,TJA,SLTJ,-21.5557003021,-64.7013015747,6079,U,America/La_Paz,airport,OurAirports,Tarija Airport,ChIJTRIwLcFHBpQRxd_uSJAYjzE,"Tarija Airport, Av. Fuerza Aerea, Tarija, Bolivia",3.8,76,not found,8
852,2771,Viru Viru International Airport,Santa Cruz,Bolivia,VVI,SLVR,-17.6448,-63.135399,1224,U,America/La_Paz,airport,OurAirports,Viru Viru International Airport,ChIJPY-oCxLh8ZMRPADJgw2lv7Q,"Viru Viru International Airport, Av. G77, Santa Cruz de la Sierra, Bolivia",3.8,504,http://www.sabsa.aero/,24
853,2772,Yacuiba Airport,Yacuiba,Bolivia,BYC,SLYA,-21.960899353027344,-63.65169906616211,2112,U,America/La_Paz,airport,OurAirports,Yacuiba Airport,ChIJ8VsgCegrD5QR83QSukBwLuE,"Yacuiba Airport, Yacuíba +591, Bolivia",3.6,58,not found,4
854,2773,Johan Adolf Pengel International Airport,Zandery,Suriname,PBM,SMJP,5.4528298378,-55.1878013611,59,U,America/Paramaribo,airport,OurAirports,Johan Adolf Pengel International Airport,ChIJKyRz_0XsCY0R6Xi0h9wpGN0,"Johan Adolf Pengel International Airport, Luchthavenlaan 1, Paramaribo, Suriname",3.7,131,https://www.japi-airport.com/,10
855,2774,Cayenne-Rochambeau Airport,Cayenne,French Guiana,CAY,SOCA,4.819809913639999,-52.360401153599994,26,U,America/Cayenne,airport,OurAirports,Cayenne - Félix Eboué Airport,ChIJd0Y341cVEo0RS8qsTNxWZ_A,"Cayenne - Félix Eboué Airport, Matoury 97351, French Guiana",3.5,84,http://www.guyane.cci.fr/aeroport-felix-eboue/,7
856,2781,Cap FAP David Abenzur Rengifo International Airport,Pucallpa,Peru,PCL,SPCL,-8.37794017791748,-74.57430267333984,513,U,America/Lima,airport,OurAirports,FAP Captain David Abensur Rengifo International Airport,ChIJHZPhwWu9o5ERKmSJdruHnGw,"FAP Captain David Abensur Rengifo International Airport, Pucallpa 25004, Peru",4.1,536,http://www.corpac.gob.pe/,6
857,2786,Coronel FAP Alfredo Mendivil Duarte Airport,Ayacucho,Peru,AYP,SPHO,-13.154800415039062,-74.20439910888672,8917,U,America/Lima,airport,OurAirports,Coronel FAP Alfredo Mendívil Duarte Airport,ChIJxWCm7ESHEpER4egsl2ZbWo4,"Coronel FAP Alfredo Mendívil Duarte Airport (AYP), Amancaes 961, Ayacucho 05001, Peru",4.1,68,http://www.corpac.gob.pe/Main.asp?T=4120,2
858,2789,Jorge Chávez International Airport,Lima,Peru,LIM,SPIM,-12.0219,-77.114305,113,U,America/Lima,airport,OurAirports,Jorge Chavez International Airport,ChIJAR71Uj3MBZERLGUS-5eudR8,"Jorge Chavez International Airport (LIM), Av. Elmer Faucett s/n, Callao 07031, Peru",3.8,3886,http://www.lap.com.pe/,115
859,2791,Francisco Carle Airport,Jauja,Peru,JAU,SPJJ,-11.7831001282,-75.47339630130001,11034,U,America/Lima,airport,OurAirports,Francisco Carle Airport,ChIJJQ8ooynMDpER9TtCA9SE_T4,"Francisco Carle Airport (JAU), Av Francisco Carle S/N, Jauja 12601, Peru",3.4,73,http://www.corpac.gob.pe/Main.asp?T=4123,1
860,2792,Inca Manco Capac International Airport,Juliaca,Peru,JUL,SPJL,-15.467100143432615,-70.158203125,12552,U,America/Lima,airport,OurAirports,Inca Manco Capac International Airport,ChIJI54MroLxZ5ERW8LHpE8S6TY,"Inca Manco Capac International Airport, Juliaca, Peru",3.9,130,http://www.aap.com.pe/,7
861,2801,Coronel FAP Francisco Secada Vignetta International Airport,Iquitos,Peru,IQT,SPQT,-3.7847399711608887,-73.30879974365234,306,U,America/Lima,airport,OurAirports,Coronel FAP Francisco Secada Vignetta International Airport,ChIJzzLUS0wO6pERrP386hrSLr4,"Coronel FAP Francisco Secada Vignetta International Airport (IQT), Distrito de Iquitos a 6.0 Km. de la ciudad, Región de Loreto, Provincia de Maynas, Peru",4.0,127,http://www.corpac.gob.pe/Main.asp?T=4122,7
862,2802,Rodríguez Ballón International Airport,Arequipa,Peru,AQP,SPQU,-16.3411006927,-71.5830993652,8405,U,America/Lima,airport,OurAirports,Alfredo Rodriguez Ballon International Airport,ChIJLZn0MuBJQpERfLVtiq1Ztqs,"Alfredo Rodriguez Ballon International Airport, Aeropuerto, Cerro Colorado, Peru",3.7,289,http://www.aap.com.pe/aeropuerto-internacional-rodriguez-ballon,10
863,2804,Capitan FAP Carlos Martinez De Pinillos International Airport,Trujillo,Peru,TRU,SPRU,-8.08141040802002,-79.10880279541016,106,U,America/Lima,airport,OurAirports,Captain FAP Carlos Martínez de Pinillos International Airport,ChIJUSqvZgc8rZER-KKwx3eLDC0,"Captain FAP Carlos Martínez de Pinillos International Airport, Ruta al Aeropuerto 104, Huanchaco 13000, Peru",3.8,136,http://www.adp.com.pe/es/sede/trujillo,1
864,2806,Cadete FAP Guillermo Del Castillo Paredes Airport,Tarapoto,Peru,TPP,SPST,-6.508739948272705,-76.37319946289062,869,U,America/Lima,airport,OurAirports,Airport Cad. FAP Guillermo del Castillo Paredes,ChIJXbwAiY8LupERbV9suDrg1D4,"Airport Cad. FAP Guillermo del Castillo Paredes, Avenida Aviacion, Tarapoto 22201, Peru",3.9,130,not found,6
865,2807,Coronel FAP Carlos Ciriani Santa Rosa International Airport,Tacna,Peru,TCQ,SPTN,-18.0533008575,-70.2758026123,1538,U,America/Lima,airport,OurAirports,Aeropuerto Tacna,ChIJiZi1Cc7IWpERX8X8tft86eY,"Aeropuerto Tacna, Tacna 23004, Peru",4.0,80,not found,2
866,2808,Padre Aldamiz International Airport,Puerto Maldonado,Peru,PEM,SPTU,-12.613599777200001,-69.2285995483,659,U,America/Lima,airport,OurAirports,Padre Aldamiz International Airport,ChIJYyNwo9BLe5ERoFlcZbi_TZU,"Padre Aldamiz International Airport, 30C 579, Puerto Maldonado, Peru",3.8,313,not found,3
867,2809,Capitán FAP Guillermo Concha Iberico International Airport,Piura,Peru,PIU,SPUR,-5.20574998856,-80.61640167239999,120,U,America/Lima,airport,OurAirports,Capitán FAP Guillermo Concha Iberico International Airport,ChIJoTk5zY0QSpAR8HQHE233ptg,"Capitán FAP Guillermo Concha Iberico International Airport, Corpac 247, Piura, Peru",3.7,230,http://www.adp.com.pe/es/sede/piura,2
868,2812,Alejandro Velasco Astete International Airport,Cuzco,Peru,CUZ,SPZO,-13.535699844400005,-71.9387969971,10860,U,America/Lima,airport,OurAirports,Alejandro Velasco Astete Airport,ChIJJYeYhER_bpERplrqGMAag7w,"Alejandro Velasco Astete Airport, Avenida Velasco Astete, Cusco 08006, Peru",3.4,533,http://www.corpac.gob.pe/Main.asp?T=4160,11
869,2816,Carrasco International /General C L Berisso Airport,Montevideo,Uruguay,MVD,SUMU,-34.838402,-56.0308,105,S,America/Montevideo,airport,OurAirports,Carrasco International Airport,ChIJ45GmF-GHn5UR0P1OYUhZOyI,"Carrasco International Airport, Cap. Juan Antonio Artigas, 14000 Ciudad de la Costa, Departamento de Canelones, Uruguay",4.5,1246,http://www.aeropuertodecarrasco.com.uy/,23
870,2821,General José Antonio Anzoategui International Airport,Barcelona,Venezuela,BLA,SVBC,10.111111,-64.692222,30,U,America/Caracas,airport,OurAirports,General Jose Antonio Anzoategui International Airport,ChIJp_Jp611tLYwRUINbhQQph_4,"General Jose Antonio Anzoategui International Airport, Barcelona 6001, Anzoátegui, Venezuela",2.7,213,not found,11
871,2824,Barquisimeto International Airport,Barquisimeto,Venezuela,BRM,SVBM,10.042746543884276,-69.35861968994139,2042,U,America/Caracas,airport,OurAirports,Jacinto Lara International Airport,ChIJq6qqqvpmh44Rn0_Hu-bxTUg,"Jacinto Lara International Airport, Avenida la Salle y Avenida Vicente Landaeta, Barquisimeto 3001, Lara, Venezuela",3.6,152,not found,5
872,2848,La Chinita International Airport,Maracaibo,Venezuela,MAR,SVMC,10.5582084656,-71.7278594971,239,U,America/Caracas,airport,OurAirports,Airport La Chinita,ChIJLQ50lv-QiY4R5pjfj2XIpAw,"Airport La Chinita, Ave Don Manuel Belloso, Maracaibo 4004, Zulia, Venezuela",3.7,237,not found,14
873,2850,Del Caribe Santiago Mariño International Airport,Porlamar,Venezuela,PMV,SVMG,10.912603378295898,-63.96659851074219,74,U,America/Caracas,airport,OurAirports,Aeropuerto Internacional General en Jefe Santiago Mariño,ChIJk5qQaSj1MYwRRDAgM6BHssU,"Aeropuerto Internacional General en Jefe Santiago Mariño, 6320, Nueva Esparta, Venezuela",3.9,253,not found,20
874,2851,Simón Bolívar International Airport,Caracas,Venezuela,CCS,SVMI,10.601194,-66.991222,234,U,America/Caracas,airport,OurAirports,Simón Bolívar International Airport,ChIJm1N-ymNdKowRDeodyu8Sk7I,"Simón Bolívar International Airport, Maiquetía 1162, Vargas, Venezuela",3.5,185,http://www.aeropuerto-maiquetia.com.ve/,90
875,2852,Maturín Airport,Maturin,Venezuela,MUN,SVMT,9.75452995300293,-63.14739990234375,224,U,America/Caracas,airport,OurAirports,Jose Tadeo Monagas International Airport,ChIJAVIzZihBM4wRTI6y3WZDLrE,"Jose Tadeo Monagas International Airport, 15 Avenida José Tadeo Monagas, Maturín 6201, Monagas, Venezuela",3.5,347,not found,4
876,2856,General Manuel Carlos Piar International Airport,Guayana,Venezuela,PZO,SVPR,8.288530349731445,-62.7603988647461,472,U,America/Caracas,airport,OurAirports,Aeropuerto internacional manuel carlos piar,ChIJn9IIV4D5y40RoKHjj5FdnRY,"Aeropuerto internacional manuel carlos piar, Av Guayana, Ciudad Guayana 8050, Bolívar, Venezuela",3.9,151,not found,11
877,2858,San Antonio Del Tachira Airport,San Antonio,Venezuela,SVZ,SVSA,7.840829849243164,-72.439697265625,1312,U,America/Caracas,airport,OurAirports,Juan Vicente Gómez International Airport,ChIJo334TqZGZo4RkpJdB4NbgoI,"Juan Vicente Gómez International Airport, San Antonio del Táchira 5007, Táchira, Venezuela",3.7,78,not found,1
878,2861,Mayor Buenaventura Vivas International Airport,Santo Domingo,Venezuela,STD,SVSO,7.56538,-72.035103,1083,U,America/Caracas,airport,OurAirports,Mayor Buenaventura Vivas Airport,ChIJQx8xTgUGZo4RjZvON_GyoCA,"Mayor Buenaventura Vivas Airport, 5032, Táchira, Venezuela",3.6,59,not found,4
879,2874,V.C. Bird International Airport,Antigua,Antigua and Barbuda,ANU,TAPA,17.1367,-61.792702,62,U,America/Antigua,airport,OurAirports,VC Bird International Airport,ChIJeQgZR0eUEowRhxHjZxyGcN4,"VC Bird International Airport, Pavilion Dr, Osbourn, Antigua and Barbuda",4.2,460,http://vcbia.com/,35
880,2875,Sir Grantley Adams International Airport,Bridgetown,Barbados,BGI,TBPB,13.0746002197,-59.492500305200004,169,U,America/Barbados,airport,OurAirports,Grantley Adams International Airport,ChIJizQIGt30Q4wR6OhY8xCldTI,"Grantley Adams International Airport, Adams-Barrow, Gordon Cummins Hwy, Barbados",3.7,304,https://www.gaia.bb/,23
881,2877,Douglas-Charles Airport,Dominica,Dominica,DOM,TDPD,15.547,-61.299999,73,U,America/Dominica,airport,OurAirports,Douglas-Charles Airport,ChIJdZy9IZU0a4wReIIWvzoBCmA,"Douglas-Charles Airport, Melville Hall Road, Dominica",3.6,96,not found,17
882,2878,Martinique Aimé Césaire International Airport,Fort-de-france,Martinique,FDF,TFFF,14.590999603271484,-61.00320053100586,16,U,America/Martinique,airport,OurAirports,Martinique Aimé Césaire International Airport,ChIJFSnPdvmgaowRAZ45Kc4_54s,"Martinique Aimé Césaire International Airport, BP279, Le Lamentin 97285, Martinique",3.6,265,http://www.martinique.aeroport.fr/,23
883,2879,L'Espérance Airport,St. Martin,Guadeloupe,SFG,TFFG,18.099899291992,-63.047199249268,7,U,\N,airport,OurAirports,Grand Case-Espérance Airport,ChIJg-Z_iohvDowRBEZ_BDKQOZ0,"Grand Case-Espérance Airport, Route de l'Espérance, Grand-Case, St Martin",4.1,99,http://www.saintmartin-airport.com/,4
884,2881,Pointe-à-Pitre Le Raizet,Pointe-a-pitre,Guadeloupe,PTP,TFFR,16.265301,-61.531799,36,U,America/Guadeloupe,airport,OurAirports,Pointe-à-Pitre International Airport,ChIJoVSTvzxGE4wRtImMBUw2WTM,"Pointe-à-Pitre International Airport (PTP), Morne Mamiel, Les Abymes 97139, Guadeloupe",3.7,276,http://www.guadeloupe.aeroport.fr/,29
885,2883,Cyril E. King Airport,St. Thomas,Virgin Islands,STT,TIST,18.337299346923828,-64.97339630126953,23,U,America/St_Thomas,airport,OurAirports,Cyril E. King Airport,ChIJ4_mhLqEbBYwRft7XbWeaMJQ,"Cyril E. King Airport, Airport Rd, Charlotte Amalie West, St Thomas 00802, USVI",2.9,165,http://www.viport.com/airports/index.html,34
886,2884,Henry E Rohlsen Airport,St. Croix Island,Virgin Islands,STX,TISX,17.701900482177734,-64.79859924316406,74,U,America/St_Thomas,airport,OurAirports,Henry E Rohlsen International Airport,ChIJU8u-jSnJGowRrQ2CcwgO2pE,"Henry E Rohlsen International Airport, Christiansted, St Croix 00820, USVI",3.8,63,http://www.viport.com/,9
887,2885,Rafael Hernandez Airport,Aguadilla,Puerto Rico,BQN,TJBQ,18.49489974975586,-67.12940216064453,237,U,America/Puerto_Rico,airport,OurAirports,Rafael Hernández International Airport,ChIJCQXfmCeWAowRlb5cMyq1CKc,"Rafael Hernández International Airport, Hangar Rd, Aguadilla Pueblo, Aguadilla 00603, Puerto Rico",3.9,284,http://www.prpa.gobierno.pr/,4
888,2889,Mercedita Airport,Ponce,Puerto Rico,PSE,TJPS,18.00830078125,-66.56300354003906,29,U,America/Puerto_Rico,airport,OurAirports,Mercedita International Airport,ChIJOSmX7lHUHIwRbihJJYeOfJ0,"Mercedita International Airport, PR-1, Ponce, 00715, Puerto Rico",4.1,121,http://www.prpa.gobierno.pr/,2
889,2890,Luis Munoz Marin International Airport,San Juan,Puerto Rico,SJU,TJSJ,18.4393997192,-66.0018005371,9,U,America/Puerto_Rico,airport,OurAirports,Luis Muñoz Marín International Airport,ChIJB5DXENhlA4wRcCvT3VjyfhU,"Luis Muñoz Marín International Airport (SJU), Av. Aeropuerto, Carolina, 00979, Puerto Rico",3.7,867,http://aeropuertosju.com/en/,102
890,2893,George F. L. Charles Airport,Castries,Saint Lucia,SLU,TLPC,14.0202,-60.992901,22,U,America/St_Lucia,airport,OurAirports,George F.L. Charles Airport,ChIJCVL0IK5nQIwRYij4wHXcGiI,"George F.L. Charles Airport, Peninsular Rd, St Lucia",3.7,65,http://www.stlucia-airport.com/,11
