index,airport_id,name,city,country,IATA,ICAO,latitude,longitude,altitude,DST,Tz_database_time_zone	,type,source,google_airport_name,google_place_id,google_airport_full_address,airport_rating,number_ratings,website,total_routes
1287,3793,Southwest Florida International Airport,Fort Myers,United States,RSW,KRSW,26.53619956970215,-81.75520324707031,30,A,America/New_York,airport,OurAirports,Southwest Florida International Airport,ChIJgQUlvz8T24gRRk4VTw6fGPw,"Southwest Florida International Airport (RSW), 11000 Terminal Access Rd, Fort Myers, FL 33913, USA",4.2,740,http://flylcpa.com/,63
1288,3797,John F Kennedy International Airport,New York,United States,JFK,KJFK,40.63980103,-73.77890015,13,A,America/New_York,airport,OurAirports,John F. Kennedy International Airport,ChIJR0lA1VBmwokR8BGfSBOyT-w,"John F. Kennedy International Airport (JFK), Queens, NY 11430, USA",3.7,9874,https://www.jfkairport.com/,456
1289,3805,Stockton Metropolitan Airport,Stockton,United States,SCK,KSCK,37.894199371338,-121.2379989624,33,A,America/Los_Angeles,airport,OurAirports,Stockton Metropolitan Airport,ChIJ3_4I9ldrkIARZYzQ6ppX4So,"Stockton Metropolitan Airport (SCK), 5000 S Airport Way, Stockton, CA 95206, USA",3.9,74,http://www.flystockton.com/,1
1290,3806,Charleston Air Force Base-International Airport,Charleston,United States,CHS,KCHS,32.89860153,-80.04049683,46,A,America/New_York,airport,OurAirports,Charleston International Airport,ChIJoyrqSw9j_ogR3_7un9DHSxw,"Charleston International Airport (CHS), 5500 International Blvd, North Charleston, SC 29418, USA",4.0,436,https://www.iflychs.com/,34
1291,3807,Reno Tahoe International Airport,Reno,United States,RNO,KRNO,39.49909973144531,-119.76799774169922,4415,A,America/Los_Angeles,airport,OurAirports,Reno-Tahoe International Airport,ChIJF0m8rXA_mYARQFmvIP8eQBA,"Reno-Tahoe International Airport, 2001 E Plumb Ln, Reno, NV 89502, USA",4.1,360,http://www.renoairport.com/,27
1292,3811,Birmingham-Shuttlesworth International Airport,Birmingham,United States,BHM,KBHM,33.56290054,-86.75350189,650,A,America/Chicago,airport,OurAirports,Birmingham-Shuttlesworth International Airport,ChIJJVB39qQaiYgRaCvtWAigJpM,"Birmingham-Shuttlesworth International Airport (BHM), 5900 Messer Airport Hwy, Birmingham, AL 35212, USA",3.8,376,http://flybirmingham.com/,36
1293,3817,Sacramento International Airport,Sacramento,United States,SMF,KSMF,38.69540023803711,-121.59100341796876,27,A,America/Los_Angeles,airport,OurAirports,Sacramento International Airport,ChIJrXBqznMrm4ARMkLvKBKQYKQ,"Sacramento International Airport (SMF), 6900 Airport Blvd, Sacramento, CA 95837, USA",4.0,1127,http://www.smf.aero/,55
1294,3819,City of Colorado Springs Municipal Airport,Colorado Springs,United States,COS,KCOS,38.805801,-104.70099599999999,6187,A,America/Denver,airport,OurAirports,Colorado Springs Airport,ChIJdQvRTypHE4cRjamJCa7OI0Y,"Colorado Springs Airport (COS), 7770 Milton E Proby Pkwy, Colorado Springs, CO 80916, USA",4.2,396,http://www.flycos.com/,13
1295,3820,Buffalo Niagara International Airport,Buffalo,United States,BUF,KBUF,42.94049835,-78.73220062,728,A,America/New_York,airport,OurAirports,Buffalo Niagara International Airport,ChIJXYa-zMh004kRiGrBvQBy4sA,"Buffalo Niagara International Airport (BUF), 4200 Genesee St, Buffalo, NY 14225, USA",4.1,556,http://buffaloairport.com/,36
1296,3825,Bradley International Airport,Windsor Locks,United States,BDL,KBDL,41.9388999939,-72.68319702149999,173,A,America/New_York,airport,OurAirports,Bradley International Airport,ChIJucyQYcL95okRZafxtdR6Wyc,"Bradley International Airport (BDL), Schoephoester Rd, Windsor Locks, CT 06096, USA",4.0,742,http://www.bradleyairport.com/,51
1297,3826,Mc Allen Miller International Airport,Mcallen,United States,MFE,KMFE,26.17580032,-98.23860168,107,A,America/Chicago,airport,OurAirports,McAllen International Airport,ChIJJ6ej8OEJZYYRvhMhso1QSfU,"McAllen International Airport, 2500 S Bicentennial Blvd, McAllen, TX 78503, USA",3.9,190,http://mcallenairport.com/,6
1298,3829,Lubbock Preston Smith International Airport,Lubbock,United States,LBB,KLBB,33.663601,-101.822998,3282,A,America/Chicago,airport,OurAirports,Lubbock Preston Smith International Airport,ChIJh_TbeOYT_oYRr-Fxd1uOHzs,"Lubbock Preston Smith Int'l Airport (LBB), 5401 N Martin L King Blvd, Lubbock, TX 79403, USA",3.6,169,https://ci.lubbock.tx.us/departments/airport,10
1299,3830,Chicago O'Hare International Airport,Chicago,United States,ORD,KORD,41.9786,-87.9048,672,A,America/Chicago,airport,OurAirports,O'Hare International Airport,ChIJ82J3aie0D4gRS61ZAgdHF1E,"O'Hare International Airport (ORD), 10000 W O'Hare Ave, Chicago, IL 60666, USA",3.5,7053,https://www.flychicago.com/ohare/home/pages/default.aspx,558
1300,3832,Fairbanks International Airport,Fairbanks,United States,FAI,PAFA,64.81510162,-147.85600280000003,439,A,America/Anchorage,airport,OurAirports,Fairbanks International Airport,ChIJzTJ6LQ9bMlERApxNYTzMtec,"Fairbanks International Airport (FAI), 6450 Airport Way, Fairbanks, AK 99709, USA",4.4,174,http://www.dot.state.ak.us/faiiap/,27
1301,3838,Watertown International Airport,Watertown,United States,ART,KART,43.99190139770508,-76.02169799804688,325,A,America/New_York,airport,OurAirports,Watertown International Airport,ChIJ9wYW_Ylt2IkRcMdaFImC4Vc,"Watertown International Airport, 22529 Airport Dr, Dexter, NY 13634, USA",3.5,52,http://www.watertownairport.com/,4
1302,3839,Palm Springs International Airport,Palm Springs,United States,PSP,KPSP,33.829700469970696,-116.50700378417969,477,A,America/Los_Angeles,airport,OurAirports,Palm Springs International Airport,ChIJexz7C3wc24ARkCj0M00Pwtw,"Palm Springs International Airport (PSP), 3400 E Tahquitz Canyon Way, Palm Springs, CA 92262, USA",4.2,384,http://www.palmspringsca.gov/government/departments/aviation-palm-springs-international-airport-psp,26
1303,3840,Rick Husband Amarillo International Airport,Amarillo,United States,AMA,KAMA,35.219398,-101.706001,3607,A,America/Chicago,airport,OurAirports,Rick Husband Amarillo International Airport,ChIJO2aaBio2AYcRaNDxVloTp88,"Rick Husband Amarillo International Airport (AMA), 10801 Airport Blvd, Amarillo, TX 79111, USA",4.1,106,http://fly-ama.com/,10
1304,3845,Wilmington International Airport,Wilmington,United States,ILM,KILM,34.27059936523437,-77.90260314941406,32,A,America/New_York,airport,OurAirports,Wilmington International Airport,ChIJQd6TGcaKqYkR29p6xTJG1-Y,"Wilmington International Airport (ILM), 1740 Airport Blvd, Wilmington, NC 28405, USA",4.0,198,http://www.flyilm.com/,13
1305,3846,Baton Rouge Metropolitan Airport,Baton Rouge,United States,BTR,KBTR,30.533199,-91.149597,70,A,America/Chicago,airport,OurAirports,Baton Rouge Metropolitan Airport,ChIJu4PpF12fJoYRTZBQjn18g4Q,"Baton Rouge Metropolitan Airport (BTR), 9430 Jackie Cochran Dr, Baton Rouge, LA 70811, USA",3.9,141,http://www.flybtr.com/,8
1306,3849,Baltimore/Washington International Thurgood Marshall Airport,Baltimore,United States,BWI,KBWI,39.1754,-76.668297,146,A,America/New_York,airport,OurAirports,Baltimore/Washington International Thurgood Marshall Airport,ChIJC-DCu_zit4kRQBeX-gwVAAA,"Baltimore/Washington International Thurgood Marshall Airport (BWI), Baltimore, MD 21240, USA",4.0,2185,http://www.bwiairport.com/,142
1307,3852,Alexandria International Airport,Alexandria,United States,AEX,KAEX,31.32740020751953,-92.54979705810548,89,A,America/Chicago,airport,OurAirports,Alexandria International Airport,ChIJrbWeLq22OoYRE1KB_NRwwZo,"Alexandria International Airport, 1100 Frank Andrews Blvd, Alexandria, LA 71303, USA",3.4,72,https://flyaex.org/,6
1308,3857,Long Island Mac Arthur Airport,Islip,United States,ISP,KISP,40.79520035,-73.10019684,99,A,America/New_York,airport,OurAirports,Long Island MacArthur Airport,ChIJ2UTbfNI36IkRdgnXntrulAU,"Long Island MacArthur Airport (ISP), 100 Arrival Ave, Ronkonkoma, NY 11779, USA",4.1,284,http://www.macarthurairport.com/,17
1309,3858,Minneapolis-St Paul International/Wold-Chamberlain Airport,Minneapolis,United States,MSP,KMSP,44.882,-93.221802,841,A,America/Chicago,airport,OurAirports,Minneapolis−Saint Paul International Airport,ChIJB2rAhSov9ocRkTV4eHzT0ys,"Minneapolis−Saint Paul International Airport (MSP), Minnesota, USA",4.0,2176,http://www.mspairport.com/,218
1310,3861,Louis Armstrong New Orleans International Airport,New Orleans,United States,MSY,KMSY,29.99340057373047,-90.25800323486328,4,A,America/Chicago,airport,OurAirports,Louis Armstrong New Orleans International Airport,ChIJMXiDenS3IIYR0NHpnGsz4_o,"Louis Armstrong New Orleans International Airport (MSY), 900 Airline Dr, Kenner, LA 70062, USA",3.2,1445,http://www.flymsy.com/,123
1311,3862,Portland International Jetport Airport,Portland,United States,PWM,KPWM,43.64619827,-70.30930328,76,A,America/New_York,airport,OurAirports,Portland International Jetport,ChIJgasuJFmZskwRzz72S4Wlx_s,"Portland International Jetport (PWM), 1001 Westbrook St, Portland, ME 04102, USA",4.1,289,http://www.portlandjetport.org/,2
1312,3863,Will Rogers World Airport,Oklahoma City,United States,OKC,KOKC,35.39310073852539,-97.60070037841795,1295,A,America/Chicago,airport,OurAirports,Will Rogers World Airport,ChIJ3X8qew0SsocRfK4hOVnCnc4,"Will Rogers World Airport (OKC), 7100 Terminal Dr, Oklahoma City, OK 73159, USA",4.0,502,http://www.flyokc.com/,40
1313,3864,Albany International Airport,Albany,United States,ALB,KALB,42.74829864501953,-73.80169677734375,285,A,America/New_York,airport,OurAirports,Albany International Airport,ChIJnyVJL-4M3okRm11rxsejZPA,"Albany International Airport (ALB), Albany Shaker Rd, Colonie, NY, USA",4.0,321,http://www.albanyairport.com/,31
1314,3867,John Wayne Airport-Orange County Airport,Santa Ana,United States,SNA,KSNA,33.67570114,-117.86799620000001,56,A,America/Los_Angeles,airport,OurAirports,John Wayne Airport,ChIJ70Cry-3e3IAR4hkRw_XoQck,"John Wayne Airport (SNA), 18601 Airport Way, Santa Ana, CA 92707, USA",4.3,1308,https://www.ocair.com/default,42
1315,3873,Destin-Ft Walton Beach Airport,Valparaiso,United States,VPS,KVPS,30.4832,-86.525398,87,A,America/Chicago,airport,OurAirports,Destin-Fort Walton Beach Airport (VPS),ChIJMzloc3ZqkYgRPSHETKq1uYM,"Destin-Fort Walton Beach Airport (VPS), 1701 State Road 85 North, Eglin AFB, FL 32542, United States",3.5,243,http://www.flyvps.com/,10
1316,3875,Key West International Airport,Key West,United States,EYW,KEYW,24.556100845336914,-81.75959777832031,3,A,America/New_York,airport,OurAirports,Key West International Airport,ChIJv1e7Yz6x0YgRSCHkLi9wv48,"Key West International Airport, 3491 S Roosevelt Blvd, Key West, FL 33040, USA",3.9,154,http://www.eyw.com/,16
1317,3876,Charlotte Douglas International Airport,Charlotte,United States,CLT,KCLT,35.2140007019043,-80.94309997558594,748,A,America/New_York,airport,OurAirports,Charlotte Douglas International Airport,ChIJidRKt32YVogRN6fEPG9Kuho,"Charlotte Douglas International Airport (CLT), 5501 Josh Birmingham Pkwy, Charlotte, NC 28208, USA",3.3,3353,http://www.cltairport.com/Pages/default.aspx,301
1318,3877,McCarran International Airport,Las Vegas,United States,LAS,KLAS,36.08010101,-115.15200039999999,2181,A,America/Los_Angeles,airport,OurAirports,McCarran International Airport,ChIJXZwEH5_FyIARHh7EHiRZE0c,"McCarran International Airport (LAS), 5757 Wayne Newton Blvd, Las Vegas, NV 89119, USA",3.9,4361,http://www.mccarran.com/,246
1319,3878,Orlando International Airport,Orlando,United States,MCO,KMCO,28.429399490356445,-81.30899810791016,96,A,America/New_York,airport,OurAirports,Orlando International Airport,ChIJ85K0xidj54gRbeERlDa5Sq0,"Orlando International Airport (MCO), 1 Jeff Fuqua Blvd, Orlando, FL 32827, USA",3.6,5820,http://www.orlandoairports.net/,237
1320,3879,Florence Regional Airport,Florence,United States,FLO,KFLO,34.18539810180664,-79.7238998413086,146,A,America/New_York,airport,OurAirports,Florence Regional Airport,ChIJb01Y-epdVYgR-h6wBDxQW68,"Florence Regional Airport, 2100 Terminal Dr, Florence, SC 29501, USA",3.2,66,http://www.flyflo.us/,2
1321,3880,Great Falls International Airport,Great Falls,United States,GTF,KGTF,47.48199844,-111.3710022,3680,A,America/Denver,airport,OurAirports,Great Falls International Airport,ChIJO49-oPVIQlMRGmVs1px0isY,"Great Falls International Airport, 2800 Terminal Dr, Great Falls, MT 59404, USA",4.2,64,https://flygtf.com/,7
1322,3885,Suvarnabhumi Airport,Bangkok,Thailand,BKK,VTBS,13.681099891662598,100.74700164794922,5,U,Asia/Bangkok,airport,OurAirports,Suvarnabhumi Airport,ChIJTydCFXdnHTERB3oVT1UZDRI,"Suvarnabhumi Airport (BKK), 999 Soi Mu Ban Nakhon Thong 1, Nong Prue, Amphoe Bang Phli, Chang Wat Samut Prakan 10540, Thailand",4.1,11848,https://www.airportthai.co.th/,326
1323,3886,Naha Airport,Naha,Indonesia,NAH,WAMH,3.683209896087648,125.52799987792969,16,N,Asia/Makassar,airport,OurAirports,Naha Airport,ChIJjSyLjsRp5TQRkP5WN6rOTFA,"Naha Airport, 150 Kagamizu, Naha, Okinawa 901-0142, Japan",3.9,1297,https://www.naha-airport.co.jp/,1
1324,3890,Wolter Monginsidi Airport,Kendari,Indonesia,KDI,WAWW,-4.081610202789307,122.41799926757812,538,N,Asia/Makassar,airport,OurAirports,Haluoleo Airport - South Konawe,ChIJpypK4HmJmC0R3gYhX14CDPg,"Haluoleo Airport - South Konawe, Jl. Bandara Haluoleo, Ambaipua, Ranomeeto, Kabupaten Konawe Selatan, Sulawesi Tenggara 93372, Indonesia",3.7,393,http://dephub.go.id/post/read/bandara-haluoleo-era-baru-masyarakat-sultra-1990,4
1325,3894,Abdul Rachman Saleh Airport,Malang,Indonesia,MLG,WARA,-7.926559925079999,112.71499633799999,1726,N,Asia/Jakarta,airport,OurAirports,Abdulrachman Saleh Airport,ChIJc7zWg1Ip1i0RMD5Mxnd6Ag8,"Abdulrachman Saleh Airport, Jl. Komodor Udara Abdul Rahman Saleh, Krajan, Bunut Wetan, Kec. Pakis, Malang, Jawa Timur 65154, Indonesia",4.0,970,not found,3
1326,3896,Husein Sastranegara International Airport,Bandung,Indonesia,BDO,WICC,-6.900629997253418,107.57599639892578,2436,N,Asia/Jakarta,airport,OurAirports,Husein Sastranegara International Airport,ChIJVRf_IGvmaC4RhuriCe2SFrw,"Husein Sastranegara International Airport, Jl. Pajajaran No.156, Husen Sastranegara, Kec. Cicendo, Kota Bandung, Jawa Barat 40174, Indonesia",4.1,696,http://huseinsastranegara-airport.co.id/,21
1327,3898,Adi Sutjipto International Airport,Yogyakarta,Indonesia,JOG,WARJ,-7.788179874420166,110.43199920654295,350,N,Asia/Jakarta,airport,OurAirports,Adisucipto International Airport,ChIJG9KV-alQei4R8D1Mxnd6Ag8,"Adisucipto International Airport (JOG), Jl. Raya Solo KM.9, Maguwoharjo, Kec. Depok, Kabupaten Sleman, Daerah Istimewa Yogyakarta 55282, Indonesia",4.0,4430,http://adisutjipto-airport.co.id/,29
1328,3901,Achmad Yani Airport,Semarang,Indonesia,SRG,WARS,-6.97273,110.375,10,N,Asia/Jakarta,airport,OurAirports,Jenderal Ahmad Yani International Airport,ChIJgWh5VZ-McC4RYOenO5gW2TA,"Jenderal Ahmad Yani International Airport, Tambakharjo, Kec. Semarang Bar., Kota Semarang, Jawa Tengah, Indonesia",4.0,2390,http://ahmadyani-airport.com/,17
1329,3903,Hang Nadim International Airport,Batam,Indonesia,BTH,WIDD,1.12102997303,104.119003296,126,N,Asia/Jakarta,airport,OurAirports,Hang Nadim Airport,ChIJkfUrRqaF2TERSH40XFkYolA,"Hang Nadim Airport (BTH), Jl. Hang Nadim No.01, Batu Besar, Kecamatan Nongsa, Kota Batam, Kepulauan Riau 29466, Indonesia",4.1,1491,not found,27
1330,3904,Buluh Tumbang (H A S Hanandjoeddin) Airport,Tanjung Pandan,Indonesia,TJQ,WIOD,-2.74571990967,107.754997253,164,N,Asia/Jakarta,airport,OurAirports,H.A.S. Hanandjoeddin Airport,ChIJVZaBmTkWFy4R2djoFFG9C0c,"H.A.S. Hanandjoeddin Airport, Jalan Buluh Tumbang, Tanjung Pandan, Buluh Tumbang, Tj. Pandan, Kabupaten Belitung, Kepulauan Bangka Belitung, Indonesia",4.0,396,not found,4
1331,3905,Pangkal Pinang (Depati Amir) Airport,Pangkal Pinang,Indonesia,PGK,WIPK,-2.16219997406,106.138999939,109,N,Asia/Jakarta,airport,OurAirports,Depati Amir Airport,ChIJ8U7cum7HIi4R1KXRhmwyq7M,"Depati Amir Airport, Dul, Beluluk, Kec. Pangkalan Baru, Kabupaten Bangka Tengah, Kepulauan Bangka Belitung 33684, Indonesia",4.1,821,http://depatiamir-airport.co.id/,7
1332,3906,Raja Haji Fisabilillah International Airport,Tanjung Pinang,Indonesia,TNJ,WIDN,0.9226830005650001,104.53199768100001,52,N,Asia/Jakarta,airport,OurAirports,Pinang Kencana,ChIJO8AK-VNs2TER6k3XqYhPDuw,"CARGO TERMINAL BUILDING, BANDARA INTERNASIONAL RHF, Pinang Kencana, Bukit Bestari, Kota Tanjung Pinang, Kepulauan Riau 29125, Indonesia",4.2,252,http://www.rajahajifisabilillah-airport.co.id/,3
1333,3908,Syamsudin Noor Airport,Banjarmasin,Indonesia,BDJ,WAOO,-3.4423599243164062,114.76300048828124,66,N,Asia/Makassar,airport,OurAirports,Koperasi Bandara,ChIJlxHAzHqD5i0RxqbtIOjBlYQ,"Koperasi Bandara, Jl. Kasturi 2 No.10, Landasan Ulin Utara, Ulin, Kota Banjar Baru, Kalimantan Selatan 70713, Indonesia",4.1,6359,not found,15
1334,3910,Iskandar Airport,Pangkalan Bun,Indonesia,PKN,WAOI,-2.70519995689,111.672996521,75,N,Asia/Jakarta,airport,OurAirports,Iskandar Airport,ChIJiYUJtCXwCC4RU8-CIbsMl80,"Iskandar Airport, Jl. Iskandar, Pasir Panjang, Kec. Arut Sel., Kabupaten Kotawaringin Barat, Kalimantan Tengah 74181, Indonesia",4.0,336,not found,7
1335,3911,Tjilik Riwut Airport,Palangkaraya,Indonesia,PKY,WAOP,-2.22513008118,113.943000793,82,N,Asia/Jakarta,airport,OurAirports,Tjilik Riwut Airport,ChIJU8azEpqy_C0RqtZHqoBbcBQ,"Tjilik Riwut Airport, Panarung, Kec. Pahandut, Kota Palangka Raya, Kalimantan Tengah 74874, Indonesia",3.9,390,not found,3
1336,3913,Maumere(Wai Oti) Airport,Maumere,Indonesia,MOF,WATC,-8.640649795529999,122.23699951200001,115,N,Asia/Makassar,airport,OurAirports,Maumere Airport,ChIJ_3Jt3GgZrS0R94fPNZZD2GA,"Maumere Airport, Jalan Adi Sucipto, Waioti, Alok Timur, Waioti, Alok Tim., Kabupaten Sikka, Nusa Tenggara Tim., Indonesia",4.1,146,not found,3
1337,3914,Ende (H Hasan Aroeboesman) Airport,Ende,Indonesia,ENE,WATE,-8.8492898941,121.66100311299999,49,N,Asia/Makassar,airport,OurAirports,H. Hasan Aroeboesman Airport,ChIJtd92a0pfrS0RE9iNvHakJYA,"H. Hasan Aroeboesman Airport, Kel. Tetandara, Flores, Ende, Nusa Tenggara Tim., Indonesia",4.1,146,not found,4
1338,3916,El Tari Airport,Kupang,Indonesia,KOE,WATT,-10.171600341796877,123.6709976196289,335,N,Asia/Makassar,airport,OurAirports,El Tari Kupang International Airport,ChIJu2LbKYGDViwR7ujwLSo-3E4,"El Tari Kupang International Airport (KOE), Jalan Adi Sucipto Terminal B, Penfui, Maulafa, Kota Kupang, Nusa Tenggara Tim. 85361, Indonesia",4.0,652,http://www.kupang-airport.com/,10
1339,3917,Komodo Airport,Labuhan Bajo,Indonesia,LBJ,WATO,-8.48666,119.889,66,N,Asia/Makassar,airport,OurAirports,Bandara Komodo,ChIJOevwo9NltC0REtCGs6HCWPw,"Bandara Komodo, Jl. Eltari, Labuan Bajo, Batu Cermin, Kecamatan Komodo, Batu Cermin, Komodo, Kabupaten Manggarai Barat, Nusa Tenggara Tim. 86554, Indonesia",4.0,447,not found,4
1340,3919,Sultan Aji Muhamad Sulaiman Airport,Balikpapan,Indonesia,BPN,WALL,-1.2682700157200002,116.89399719200001,12,N,Asia/Makassar,airport,OurAirports,Sultan Aji Muhammad Sulaiman Sepinggan International Airport,ChIJeb24DS5H8S0RYMq-M3gZJDw,"Sultan Aji Muhammad Sulaiman Sepinggan International Airport (BPN), Jl. Marsma R. Iswahyudi, Sepinggan, Kecamatan Balikpapan Selatan, Kota Balikpapan, Kalimantan Timur 76115, Indonesia",4.5,3556,https://www.sepinggan-airport.com/id#,36
1341,3920,Juwata Airport,Taraken,Indonesia,TRK,WALR,3.326667,117.56944399999999,23,N,Asia/Makassar,airport,OurAirports,Juwata Airport,ChIJcwK5Flt1FDIR1UJDKNEvIt8,"Juwata Airport, Karang Anyar Pantai, Tarakan Bar., Kota Tarakan, Kalimantan Utara, Indonesia",4.0,369,not found,7
1342,3924,Muhammad Salahuddin Airport,Bima,Indonesia,BMU,WADB,-8.539649963378901,118.68699645996,3,N,Asia/Makassar,airport,OurAirports,Sultan Muhammad Salahuddin Airport,ChIJh9XEzg-ItS0RYZraOQRIA-s,"Sultan Muhammad Salahuddin Airport, Jalan Sumbawa, Belo, Palibelo, Belo, Palibelo, Bima, Nusa Tenggara Bar. 84173, Indonesia",3.8,168,not found,3
1343,3927,Umbu Mehang Kunda Airport,Waingapu,Indonesia,WGP,WADW,-9.66922,120.302002,33,N,Asia/Makassar,airport,OurAirports,Umbu Mehang Kunda Airport,ChIJ433LbSuFTCwR6OFvdYG_qio,"Umbu Mehang Kunda Airport, Mau Hau, Kambera, Kabupaten Sumba Timur, Nusa Tenggara Tim., Indonesia",3.9,127,not found,1
1344,3928,Juanda International Airport,Surabaya,Indonesia,SUB,WARR,-7.379829883575439,112.78700256347656,9,N,Asia/Jakarta,airport,OurAirports,Juanda International Airport,ChIJuVn5Owvl1y0R6BhjeFh8_8A,"Juanda International Airport (SUB), Jl. Ir. H. Juanda, Betro, Kec. Sedati, Kabupaten Sidoarjo, Jawa Timur 61253, Indonesia",4.2,7291,http://www.juanda-airport.com/,65
1345,3929,Adi Sumarmo Wiryokusumo Airport,Solo City,Indonesia,SOC,WARQ,-7.516089916229247,110.75700378417969,421,N,Asia/Jakarta,airport,OurAirports,Adi Soemarmo International Airport,ChIJ_____5ITei4RiKcMDLZiCcU,"Adi Soemarmo International Airport, Jl. Cendrawasih, Ngesrep, Kec. Ngemplak, Kabupaten Boyolali, Jawa Tengah 57375, Indonesia",4.2,1531,https://adisumarmo-airport.com/id,8
1346,3930,Incheon International Airport,Seoul,South Korea,ICN,RKSI,37.46910095214844,126.45099639892578,23,U,Asia/Seoul,airport,OurAirports,Incheon International Airport,ChIJWfpeOoOaezUR1L5cy5agS40,"Incheon International Airport (ICN), 272 Gonghang-ro, Jung-gu, Incheon, South Korea",4.5,7679,http://www.airport.kr/,370
1347,3931,Chiang Mai International Airport,Chiang Mai,Thailand,CNX,VTCC,18.7667999268,98.962600708,1036,U,Asia/Bangkok,airport,OurAirports,Chiang Mai International Airport,ChIJifGY5ogw2jARl0WT_eN0JKA,"Chiang Mai International Airport (CNX), 60 Mahidol Rd, Amphoe Mueang Chiang Mai, Chang Wat Chiang Mai 50200, Thailand",3.8,1473,https://www.airportthai.co.th/th/,48
1348,3932,Chiang Rai International Airport,Chiang Rai,Thailand,CEI,VTCT,19.952299118,99.8828964233,1280,U,Asia/Bangkok,airport,OurAirports,Mae Fah Luang - Chiang Rai International Airport,ChIJr1tqy0sH1zARMA5LOaVlKGg,"Mae Fah Luang - Chiang Rai International Airport, 404 moo 4 Ban Du - Rim Kok Ban Du - Rim Kok Amphoe Chang Wat Chiang Rai 57000, Thailand",4.0,265,https://chiangraiairportthai.com/,11
1349,3933,Nakhon Si Thammarat Airport,Nakhon Si Thammarat,Thailand,NST,VTSF,8.539620399475098,99.9447021484375,13,U,Asia/Bangkok,airport,OurAirports,Nakhon Si Thammarat Airport,ChIJDfUHKN4GUzARiLZ0-QKSY8g,"Nakhon Si Thammarat Airport (NST), Amphoe Mueang Nakhon Si Thammarat, Chang Wat Nakhon Si Thammarat, Thailand",3.9,244,https://www.facebook.com/%E0%B8%97%E0%B9%88%E0%B8%B2%E0%B8%AD%E0%B8%B2%E0%B8%81%E0%B8%B2%E0%B8%A8%E0%B8%A2%E0%B8%B2%E0%B8%99%E0%B8%99%E0%B8%84%E0%B8%A3%E0%B8%A8%E0%B8%A3%E0%B8%B5%E0%B8%98%E0%B8%A3%E0%B8%A3%E0%B8%A1%E0%B8%A3%E0%B8%B2%E0%B8%8A-%E0%B8%81%E0%B8%A3%E0%B8%A1%E0%B8%97%E0%B9%88%E0%B8%B2%E0%B8%AD%E0%B8%B2%E0%B8%81%E0%B8%B2%E0%B8%A8%E0%B8%A2%E0%B8%B2%E0%B8%99-601008323437299/,2
1350,3936,Nakhon Phanom Airport,Nakhon Phanom,Thailand,KOP,VTUW,17.383800506591793,104.64299774169922,587,U,Asia/Bangkok,airport,OurAirports,Nakhon Phanom Airport,ChIJO6dwfU9zPDERADaJ8kG1Ag8,"Nakhon Phanom Airport (KOP), Na Sai, Amphoe Mueang Nakhon Phanom, Chang Wat Nakhon Phanom 48000, Thailand",4.2,92,http://minisite.airports.go.th/nakhonphanom/,2
1351,3937,Ubon Ratchathani Airport,Ubon Ratchathani,Thailand,UBP,VTUU,15.2512998581,104.870002747,406,U,Asia/Bangkok,airport,OurAirports,Ubon Ratchathani International Airport,ChIJ9fIhbbiHFjERW3hB4D6RYW0,"Ubon Ratchathani International Airport (UBP), 364 ถนน เทพโยธี Nai Mueang, Amphoe Mueang Ubon Ratchathani, Chang Wat Ubon Ratchathani 34000, Thailand",4.0,279,not found,3
1352,3938,Khon Kaen Airport,Khon Kaen,Thailand,KKC,VTUK,16.466600418099993,102.78399658200001,670,U,Asia/Bangkok,airport,OurAirports,Khon Kaen Airport,ChIJY-xR5cphIjER3zHyLJi438w,"Khon Kaen Airport (KKC), 5 ถนนมะลิวัลย์ Ban Ped Sub-district, Amphoe Mueang Khon Kaen, Chang Wat Khon Kaen 40000, Thailand",3.9,295,http://minisite.airports.go.th/khonkaen/,2
1353,3939,Sukhothai Airport,Sukhothai,Thailand,THS,VTPO,17.238000869750973,99.81819915771484,179,U,Asia/Bangkok,airport,OurAirports,Sukhothai Airport,ChIJC9kvm6783jARWFND5AOq8Bc,"Sukhothai Airport (THS), Tambon Khlong Krachong, Amphoe Sawankhalok, Chang Wat Sukhothai 64110, Thailand",4.5,113,http://www.sukhothaiairport.com/,1
1354,3940,Ngurah Rai (Bali) International Airport,Denpasar,Indonesia,DPS,WADD,-8.7481698989868,115.16699981689,14,N,Asia/Makassar,airport,OurAirports,Ngurah Rai International Airport,ChIJM2khUBZE0i0RH8x73W3acd8,"Ngurah Rai International Airport (DPS), Jalan Raya Gusti Ngurah Rai, Tuban, Kuta, Kabupatén Badung, Bali 80362, Indonesia",4.2,7746,http://bali-airport.com/,100
1355,3941,Eleftherios Venizelos International Airport,Athens,Greece,ATH,LGAV,37.9364013672,23.944499969499997,308,E,Europe/Athens,airport,OurAirports,Athens International Airport,ChIJYVzn2RqQoRQRqrPuCt8Vsjg,"Athens International Airport (ATH), Attiki Odos, Spata Artemida 190 04, Greece",4.3,4830,http://www.aia.gr/traveler/,197
1356,3942,Chubu Centrair International Airport,Nagoya,Japan,NGO,RJGG,34.8583984375,136.80499267578122,15,U,Asia/Tokyo,airport,OurAirports,Chubu Centrair International Airport,ChIJzynM7ZN9BGARJQAsbih9mEI,"Chubu Centrair International Airport (NGO), 1 Chome-1 Centrair, Tokoname, Aichi 479-0881, Japan",4.3,1928,https://www.centrair.jp/,84
1357,3943,Kobe Airport,Kobe,Japan,UKB,RJBE,34.632801055908196,135.2239990234375,22,U,Asia/Tokyo,airport,OurAirports,Kobe Airport,ChIJXSAmuWeIAGARW3BMlO8FPKY,"Kobe Airport (UKB), 1 Kobekuko, Chuo Ward, Kobe, Hyogo 650-0048, Japan",3.9,461,https://www.kairport.co.jp/,12
1358,3946,Elmira Corning Regional Airport,Elmira,United States,ELM,KELM,42.1599006652832,-76.8916015625,954,A,America/New_York,airport,OurAirports,Elmira/Corning Regional Airport,ChIJ7_wQchdB0IkR-ND6CfOfj9E,"Elmira/Corning Regional Airport, 276 Sing Sing Rd #1, Horseheads, NY 14845, USA",3.8,69,http://ecairport.com/,6
1359,3947,Ithaca Tompkins Regional Airport,Ithaca,United States,ITH,KITH,42.49100112915039,-76.4583969116211,1099,A,America/New_York,airport,OurAirports,Ithaca Tompkins Regional Airport,ChIJszeFOYKC0IkRlB30nHIDFFM,"Ithaca Tompkins Regional Airport, 1 Culligan Dr, Ithaca, NY 14850, USA",3.3,64,http://flyithaca.com/,4
